Study ID,Respondent Login ID,Survey Date,Q704,Q705,Q706_1,Q706_2,Q706_3,Q706_4,Q706_5,Q706_6,Q706_7,Q706_8,Q706_9,Q706_10,Q706_11,Q706_12,Q706_13,Q706_14,Q706_15,Q706_16,Q706_17,Q706_18,Q706_19,Q706_20,Q706_21,Q706_22,Q706_23,Q706_24,Q708,Q709,Q711,Q712,Q713,Q715,Q716,Q718,Q719,Q721,Q722,Q724,Q725,Q726,Q728,Q729,Q730,Q732,Q733,Q734,Q736,Q737,Q739,Q740,Q742,Q743,Q744,Q745,Q747,Q748,Q750,Q751,Q753,Q754,Q755,Q756,Q757,Q759,Q760,Q762,Q763,Q764,Q766,Q767,Q769,Q770,Q772,Q773,Q774,Q775,Q776,Q777,Q779,Q780,Q781,Q783,Q784,Q785,Q786,Q788,Q789,Q791,Q792,Q794,Q795_1,Q795_2,Q797,Q798,Q799,Q800,Q801,Q803,Q804,Q805,Q806,Q807,Q808,Q809,Q810,Q811,Q812_1,Q812_2,Q812_3,Q812_4,Q812_5,Q812_6,Q812_7,Q812_8,Q812_9,Q812_10,Q812_11,Q812_12,Q812_13,Q812_14,Q812_15,Q812_16,Q814,Q815,Q817,Q818,Q820,Q821,Q823,Q824,Q826,Q827,Q829,Q830,Q832,Q833,Q835,Q836,Q838,Q839,Q841,Q842,Q844,Q845,Q847,Q848,Q850,Q851,Q853,Q854,Q856,Q857,Q859,Q860,Q861_1,Q861_2,Q861_3,Q861_4,Q861_5,Q861_6,Q861_7,Q861_8,Q861_9,Q861_10,Q861_11,Q861_12,Q861_13,Q861_14,Q861_15,Q861_16,Q861_17,Q861_18,Q861_19,Q861_20,Q861_21,Q861_22,Q861_23,Q861_24,Q861_25,Q861_26,Q861_27,Q863,Q864,Q866,Q867,Q869,Q870,Q872,Q873,Q875,Q876,Q878,Q879,Q881,Q882,Q884,Q885,Q887,Q888,Q890,Q891,Q893,Q894,Q896,Q897,Q899,Q900,Q902,Q903,Q905,Q906,Q907,Q908_1,Q908_2,Q908_3,Q908_4,Q909,Q910,Q911,Q912_1,Q912_2,Q912_3,Q912_4,Q913,Q914,Q916,Q917,Q918,Q920,Q921,Q923,Q924,Q926,Q927,Q929,Q930,Q932,Q933,Q935,Q936,Q938,Q939,Q941,Q942,Q944,Q945,Q946,Q947,Q948,Q949,Q950,Q951,Q953,Q954,Q955,Q957,Q958,Q959_1,Q959_2,Q959_3,Q959_4,Q961,Q962,Q963,Q964,Q965,Q967,Q968,Q970,Q971,Q972,Q973,Q975,Q976,Q977,Q978_1,Q978_2,Q978_3,Q978_4,Q978_5,Q978_6,Q978_7,Q980,Q981,Q982,Q984,Q985,Q987,Q988,Q990,Q991,Q993,Q994,Q996,Q997,Q998,Q999,Q1000,Q1002,Q1003,Q1004,Q1005_1,Q1005_2,Q1005_3,Q1005_4,Q1005_5,Q1005_6,Q1005_7,Q1005_8,Q1005_9,Q1005_10,Q1005_11,Q1007,Q1008,Q1010,Q1011,Q1012,Q1013,Q1014,Q1015,Q1016,Q1017,Q1018,Q1020,Q1021,Q1022,Q1023,Q1024,Q1025,Q1026,Q1027,Q1029,Q1030,Q1031,Q1032,Q1033,Q1034,Q1035,Q1036,Q1038,Q1039,Q1040,Q1041,Q1042,Q1043,Q1044,Q1045,Q1047,Q1048,Q1049,Q1050,Q1051,Q1052,Q1053,Q1054,Q1056,Q1057,Q1059,Q1060,Q1062,Q1063,Q1065,Q1066,Q1068,Q1069,Q1070_1,Q1070_2,Q1070_3,Q1070_4,Q1070_5,Q1070_6,Q1072,Q1073,Q1075,Q1076,Q1078,Q1079,Q1081,Q1082,Q1084,Q1085,Q1087,Q1088,Q1089,Q1090,Q1091_1,Q1091_2,Q1091_3,Q1091_4,Q1091_5,Q1091_6,Q1091_7,Q1091_8,Q1091_9,Q1091_10,Q1091_11,Q1091_12,Q1091_13,Q1091_14,Q1091_15,Q1091_16,Q1091_17,Q1091_18,Q1091_19,Q1091_20,Q1091_21,Q1091_22,Q1091_23,Q1091_24,Q1093,Q1094,Q1096,Q1097,Q1098,Q1099,Q1100,Q1101,Q1102,Q1103,Q1104,Q1106,Q1107,Q1109,Q1110,Q1112,Q1113,Q1115,Q1116,Q1117,Q1118,Q1119,Q1120,Q1122,Q1123,Q1125,Q1126,Q1128,Q1129,Q1131,Q1132,Q1133,Q1134,Q1135,Q1136,Q1138,Q1139,Q1141,Q1142,Q1144,Q1145,Q1146,Q1147,Q1148,Q1149,Q1151,Q1152,Q1154,Q1155,Q1157,Q1158,Q1159,Q1160,Q1161,Q1162,Q1164,Q1165,Q1166,Q1167,Q1168,Q1169,Q1171,Q1172,Q1174,Q1175,Q1177,Q1178,Q1180,Q1181,Q1183,Q1184,Q1186,Q1187,Q1189,Q1190,Q1191_1,Q1191_2,Q1193,Q1194,Q1196,Q1197,Q1198,Q1199,Q1200,Q1201_1,Q1201_2,Q1201_3,Q1201_4,Q1201_5,Q1201_6,Q1201_7,Q1201_8,Q1201_9,Q1203,Q1204,Q1206,Q1207,Q1209,Q1210,Q1212,Q1213,Q1215,Q1216,Q1218,Q1219,Q1220,Q1221,Q1223,Q1224,Q1226,Q1227,Q1229,Q1230,Q1231_1,Q1231_2,Q1231_3,Q1231_4,Q1233,Q1234,Q1235,Q1237,Q1238,Q1240,Q1241,Q1242,Q1244,Q1245,Q1246,Q1247_1,Q1247_2,Q1247_3,Q1247_4,Q1247_5,Q1247_6,Q1247_7,Q1247_8,Q1247_9,Q1247_10,Q1247_11,Q1249,Q1250,Q1252,Q1253,Q1254,Q1256,Q1257,Q1259,Q1260,Q1261,Q1262,Q1264,Q1265,Q1267,Q1268,Q1270,Q1271,Q1273,Q1274,Q1276,Q1277,Q1279,Q1280,Q1282,Q1283,Q1284_1,Q1284_2,Q1284_3,Q1286,Q1288,Q1290,Q1291,Q1292_1,Q1292_2,Q1292_3,Q1292_4,Q1292_5,Q1293_1,Q1293_2,Q1293_3,Q1293_4,Q1293_5,Q1293_6,Q1293_7,Q1293_8,Q1293_9,Q1293_10,Q1293_11,Q1293_12,Q1293_13,Q1293_14,Q1293_15,Q1293_16,Q1293_17,Q1293_18,Q1293_19,Q1293_20,Q1293_21,Q1293_22,Q1293_23,Q1293_24,Q1293_25,Q1293_26,Q1295,Q1296,Q1297,Q1298,Q1299,Q1301,Q1303,Q1305,Q1306,Q1307,Q1309,Q1310,Q1312,Q1313,Q1315,Q1317,Q1318,Q1319,Q1320,Q1321,Q1323,Q1325,Q1327,Q1328,Q1330,Q1332,Q1334,Q1335,Q1337,Q1338,Q1340,Q1342,Q1343,Q1345,Q1347,Q1348,Q1350,Q1352,Q1354,Q1355,Q1357,Q1358,Q1360,Q1361,Q1363,Q1364,Q1366_1,Q1366_2,Q1366_3,Q1366_4,Q1366_5,Q1366_6,Q1366_7,Q1366_8,Q1366_9,Q1366_10,Q1366_11,Q1366_12,Q1366_13
209,Fiber01,20180919,199003,Male,No,Yes,No,Yes,Yes,Yes,Yes,No,No,Yes,Yes,No,No,Yes,Yes,Yes,No,Yes,Yes,Yes,Yes,No,Yes,Yes,.,.,2-3 times in the past month,3/4 to 1 1/2 cups (6 to 12 ounces),Almost always or always,.,.,2-3 times in the past month,3/4 to 1 1/2 cups (6 to 12 ounces),1 time in the past month,1 to 2 cups (8 to 16 ounces),2-3 times in the past month,3/4 to 1 1/2 cups (6 to 12 ounces),About  1/2 of the time,5-6 times per week,3/4 to 1 1/2 cups (6 to 12 ounces),Almond milk,.,.,.,.,.,3-4 times per week,More than 1 1/2 cups (12 ounces),2-3 times in the past month,Less than 1 can or bottle (12 ounces),About  1/4 of the time,About  1/4 of the time,.,.,.,.,6 or more times per day,1 to 3 cups (8 to 24 ounces),Almost never or never,Almost never or never,About  1/2 of the time,2-3 times in the past month,1 to 2 bottles (12 to 20 ounces),1-2 times per week,1 to 3 12-ounce cans or bottles,About  1/2 of the time,.,.,2-3 times in the past month,More than 4 shots of liquor,1 cup per week,About  3/4 of the time,Almost never or never,Almost never or never,Almost never or never,About  1/4 of the time,2-3 times in the past month,Small to medium drink (12 to 16 ounces),Almost never or never,"2-4 glasses, cans, or bottles per week",Almost never or never,Almost never or never,.,.,.,1-3 cups in the past month,Almost never or never,1-3 cups in the past month,No,Yes,.,.,.,.,.,Almost never or never,.,.,About  1/4 of the time,1 to 3 teaspoons,Regular,Almost always or always,1 to 4 tablespoons,Almond milk,No,Yes,Yes,Yes,No,Yes,Yes,Yes,Yes,Yes,Yes,Yes,Yes,No,Yes,No,.,.,2-3 times in the past month,1 apple,1 time per week,1 banana,1 time per week,More than  3/4 cup or more than 1 medium slice,.,.,2 times per week,1 fruit,2-3 times in the past month,1 to 4 tablespoons,2 times per week,1/2 to 1 1/2 cups or 10 to 30 grapes,2-3 times in the past month,1/4 melon or  1/2 to 1 cup,2-3 times in the past month,1/2 to 2 cups or 1 medium wedge,2 times per week,More than  3/4 cup or more than 8 berries,2-3 times in the past month,1/4 to  1/2 cup,2-3 times in the past month,"1 orange or tangerine, or 2 clementines",.,.,2 times per week,3/4 avocado or more than  3/4 cup of guacamole,.,.,Yes,Yes,No,No,Yes,Yes,Yes,No,Yes,Yes,Yes,Yes,No,Yes,Yes,Yes,No,No,Yes,Yes,Yes,No,Yes,Yes,Yes,No,No,3-4 times per week,1/4 to  3/4 cup,3-4 times per week,1/2 to 1 3/4 cups,.,.,.,.,1 time per week,1/4 to  1/2 cup,1 time per week,1/4 to  1/2 cup,2-3 times in the past month,3/4 to 1 1/4 cups,.,.,2 times per week,1 ear or  1/2 to  3/4 cup,3-4 times per week,1/4 to 1 1/2 cups,1 time per week,1/4 to 1 1/4 cups,1 time per week,1/4 to  1/2 pepper,.,.,2 times per week,Less than 1 clove or less than 1 teaspoon,2 times per week,3/4 to 1 3/4 cups,2 times per week,No,No,Yes,Yes,.,1 to 3 teaspoons,NEVER,No,No,No,No,.,.,2 times per week,More than 2 cups,About  3/4 of the time,.,.,.,.,2 times per week,1/4 to  1/2 tomato,1 time per week,1 to 4 tablespoons,1 time per week,Less than 1 teaspoon,.,.,1 time per week,10 to 25 fries or  1/2 to 1 1/4 cup,1 time per week,More than  3/4 cup,1 time per week,1 medium potato or  1/2 to  3/4 cup,About  3/4 of the time,Almost never or never,.,Almost never or never,About  3/4 of the time,1 to 3 teaspoons,.,.,.,.,.,Yes,Yes,Yes,Yes,2-3 times in the past month,More than 2 cups,Almost never or never,Almost never or never,Almost always or always,1 time in the past month,1/2  to 2 cups,2 times per week,About  1/4 of the time,About  3/4 of the time,"2 to 4 tacos or 1 to 2 burritos, etc.",2 times per week,2 to 4 small size tortillas or 1 to 2 large size tortillas,About  3/4 of the time,Yes,Yes,Yes,No,No,Yes,Yes,5-6 times per week,1/2  to 1 cup,About  1/2 of the time,2-3 times in the past month,More than 8 pieces or more than 2 cups,1 time in the past month,1 to 2 cups,.,.,.,.,1 time per week,1 to 3 cups,Almost always or always,Almost never or never,About  3/4 of the time,1 time per week,More than 3 slices or more than 1 mini pizza,Almost always or always,No,No,No,No,Yes,Yes,No,No,No,Yes,Yes,.,.,.,.,.,.,.,.,.,.,.,.,.,.,.,.,.,.,.,.,.,.,.,.,.,.,.,1 time per week,1 to 2 slices or  1/2 to 1 roll,About  3/4 of the time,Almost never or never,.,Almost never or never,About  1/4 of the time,Less than 1 teaspoon,1 time per week,1 to 2 slices or  1/2 to 1 roll,About  3/4 of the time,Almost never or never,About  1/4 of the time,Less than 1 teaspoon,Almost never or never,.,.,.,.,.,.,.,1 time per week,1 to 2 tablespoons,2-3 times in the past month,1/8 to  1/2 cup,No,Yes,Yes,No,Yes,No,.,.,1 time per week,1 to 3 slices,1 time per week,2 to 4 slices,.,.,1 time per week,1 to 3 slices,.,.,.,.,No,Yes,Yes,No,No,Yes,Yes,Yes,No,No,No,No,Yes,Yes,No,Yes,Yes,No,Yes,Yes,Yes,Yes,No,No,.,.,5-6 times per week,"More than 2 drumsticks or wings, more than 1 breast or thigh, or more than 8 nuggets",About  1/4 of the time,Almost never or never,About  3/4 of the time,Almost never or never,Just until done,About  1/2 of the time,About  1/4 of the time,3-4 times per week,More than 5 ounces or more than 1 cup,.,.,.,.,1 time in the past month,More than 1 patty or more than 4 ounces,About  1/2 of the time,Almost never or never,Almost always or always,Medium,3-4 times per week,More than 8 ounces or more than 1 cup,1 time per week,1/2 to 1 1/2 cups,.,.,.,.,.,.,.,.,.,.,.,.,1 time per week,2 to 5 ounces or 1 chop,About  1/4 of the time,Almost never or never,Almost always or always,Just until done,1 time per week,1/8 to  1/4 cup,.,.,2-3 times in the past month,1 to 3 slices,About  3/4 of the time,Almost never or never,About  1/4 of the time,Well-done/crisp,2-3 times in the past month,1 to 3 patties or 2 to 5 links,About  3/4 of the time,About  1/4 of the time,About  1/4 of the time,Well-done/crisp,.,.,2-3 times in the past month,2 to 5 ounces,1 time per week,More than 7 ounces,1 time in the past month,More than 3 ounces,2-3 times in the past month,More than 4 ounces,.,.,.,.,Yes,Yes,2-3 times in the past month,More than  1/2 cup to more than 4 ounces,3-4 times per week,2 eggs,Almost always or always,About  3/4 of the time,Almost never or never,Yes,Yes,Yes,Yes,Yes,Yes,Yes,Yes,Yes,2-3 times in the past month,More than 5 crackers,1 time per week,10 to 25 chips or  1/2 to 1 cups,1 time per week,10 to 25 chips or 1 to 2 cups,1 time per week,"2 to 6 cups, popped",2-3 times in the past month,5 to 20 average twists,1 time per week,1/8 to  1/2 cup,Almost never or never,Almost never or never,5-6 times per week,1/2 to 1 bar,5-6 times per week,1 3/4 to 4 tablespoons or 1 to 2 scoops,5-6 times per week,1 to 2 bars,Yes,No,Yes,No,3-4 times per week,1/2 to  3/4 cup or 1 container,Almost always or always,.,.,2-3 times in the past month,Less than  1/2 ounce or less than 1 slice,About  1/2 of the time,.,.,.,Yes,Yes,Yes,Yes,Yes,Yes,Yes,No,No,Yes,No,2-3 times in the past month,More than 1 1/2 cups or more than 2 scoops,1 time per week,1/2 to 1 1/2 cups or 1 to 2 scoops,About  1/2 of the time,2-3 times in the past month,1 medium piece or  1/8 of a cake,2-3 times in the past month,1 medium piece or  1/8 of a cake,Almost never or never,About  3/4 of the time,1 time per week,2 to 4 cookies,1 time per week,1 medium brownie,2-3 times in the past month,1 to 2 pieces,.,.,.,.,3-4 times per week,1 to 2 squares in a bar or 1 to 2 ounces,.,.,No,No,No,.,.,.,No,No,No,No,No,No,No,No,No,No,No,No,No,No,No,No,No,No,No,No,No,No,No,No,No,No,No,No,No,No,No,No,.,.,.,.,.,.,.,.,.,.,.,.,.,.,.,.,.,.,.,.,.,.,.,.,.,.,.,.,.,.,.,.,.,.,.,.,.,.,.,.,.,.,.,.,.,.,.,.,.,.,.,.,.,.,.,.,.,.,.
209,Fiber02,20181016,198602,Male,No,No,No,No,No,No,Yes,No,No,No,Yes,No,No,Yes,No,Yes,No,No,Yes,No,Yes,No,No,No,.,.,.,.,.,.,.,.,.,.,.,.,.,.,1-2 times per week,Less than  3/4 cup (6 ounces),Almond milk,.,.,.,.,.,.,.,2-3 times in the past month,Less than 1 can or bottle (12 ounces),About  1/2 of the time,Almost never or never,.,.,.,.,2-3 times per day,More than 3 cups (24 ounces),Almost always or always,Almost never or never,About  1/2 of the time,.,.,2-3 times in the past month,1 to 3 12-ounce cans or bottles,Almost never or never,.,.,.,.,2-3 cups per day,Almost always or always,Almost never or never,Almost never or never,Almost never or never,Almost always or always,.,.,.,"1-3 glasses, cans, or bottles in the past month",Almost never or never,Almost never or never,.,.,.,.,.,.,No,No,.,.,.,.,.,.,.,.,.,.,.,.,.,.,No,Yes,Yes,No,No,No,No,No,No,No,Yes,Yes,No,No,Yes,No,.,.,2-3 times in the past month,1 apple,1 time per week,1 banana,.,.,.,.,.,.,.,.,.,.,.,.,.,.,2 times per week,1/4 to  3/4 cup or 3 to 8 berries,2 times per week,1/4 to  1/2 cup,.,.,.,.,3-4 times per week,1/4 to  3/4 avocado or  1/4 to  3/4 cup of guacamole,.,.,No,Yes,No,No,No,Yes,No,No,No,Yes,No,No,No,No,Yes,No,No,No,Yes,No,Yes,Yes,Yes,No,No,No,No,.,.,5-6 times per week,1/2 to 1 3/4 cups,.,.,.,.,.,.,2-3 times in the past month,1/4 to  1/2 cup,.,.,.,.,.,.,2-3 times in the past month,Less than  1/4 cup,.,.,.,.,.,.,.,.,2 times per week,More than 1 3/4 cups,NEVER,No,No,No,No,.,.,NEVER,No,No,No,No,.,.,.,.,.,.,.,.,.,2-3 times in the past month,1/4 to  1/2 tomato,.,.,1 time per week,1 to 4 teaspoons,5-6 times per week,1 small potato or less than  1/4 cup,1 time per week,10 to 25 fries or  1/2 to 1 1/4 cup,.,.,.,.,.,.,.,.,.,.,.,.,.,.,.,No,No,Yes,Yes,.,.,.,.,.,.,.,2 times per week,Almost never or never,About  1/2 of the time,"2 to 4 tacos or 1 to 2 burritos, etc.",2 times per week,Fewer than 2 small size tortillas or less than 1 large size tortilla,Almost never or never,No,No,Yes,No,No,No,Yes,.,.,.,.,.,1 time in the past month,1 to 2 cups,.,.,.,.,.,.,.,.,.,2-3 times in the past month,1 to 3 slices or 1 mini pizza,About  1/4 of the time,No,Yes,No,No,No,No,No,Yes,Yes,No,Yes,.,.,3-4 times per week,1 to 2 cups,Almost always or always,Almost never or never,Almost never or never,Almost never or never,Yes,Almond milk,1/2 to 1 cups (4 to 8 ounces),.,.,.,.,.,.,.,.,.,.,.,.,.,.,.,.,.,.,.,.,.,.,.,.,.,.,.,.,.,.,.,.,.,.,2-3 times in the past month,1 to 2 biscuits,2-3 times in the past month,Less than 1 teaspoon,.,.,5-6 times per week,1/8 to  1/2 cup,No,No,No,No,No,No,.,.,.,.,.,.,.,.,.,.,.,.,.,.,No,No,No,No,No,No,No,No,No,No,No,No,No,No,No,No,Yes,No,No,Yes,No,No,Yes,No,.,.,.,.,.,.,.,.,.,.,.,.,.,.,.,.,.,.,.,.,.,.,.,.,.,.,.,.,.,.,.,.,.,.,.,.,.,.,.,.,.,.,.,.,.,.,.,.,.,.,.,.,.,.,.,2-3 times in the past month,Less than 1 patty or 2 links,About  1/4 of the time,Almost never or never,About  1/2 of the time,Well-done/crisp,.,.,.,.,1 time in the past month,2 to 7 ounces,.,.,.,.,2-3 times in the past month,3 to 8 ounces or 1 fillet,.,.,Yes,Yes,1 time per week,1/4 to  1/2 cup or 2 to 4 ounces,5-6 times per week,2 eggs,Almost always or always,Almost never or never,Almost never or never,No,Yes,No,No,No,No,No,No,No,.,.,1 time per week,Fewer than 10 chips or less than  1/2 cup,.,.,.,.,.,.,.,.,.,.,.,.,.,.,.,.,No,No,Yes,No,.,.,.,.,.,2-3 times in the past month,1/2 to 1 1/2 ounces or 1 slice,About  1/2 of the time,.,.,.,No,No,No,No,No,No,No,No,No,No,No,.,.,.,.,.,.,.,.,.,.,.,.,.,.,.,.,.,.,.,.,.,.,.,.,.,No,No,No,.,.,.,No,No,No,No,No,No,No,No,No,No,No,No,No,No,No,No,No,No,No,No,No,No,No,No,No,No,No,No,No,No,No,No,.,.,.,.,.,.,.,.,.,.,.,.,.,.,.,.,.,.,.,.,.,.,.,.,.,.,.,.,.,.,.,.,.,.,.,.,.,.,.,.,.,.,.,.,.,.,.,.,.,.,.,.,.,.,.,.,.,.,.
209,Fiber03,20180928,199202,Female,No,No,No,No,Yes,Yes,Yes,No,No,Yes,Yes,Yes,Yes,Yes,Yes,Yes,Yes,Yes,Yes,Yes,Yes,No,Yes,Yes,.,.,.,.,.,.,.,.,.,2-3 times in the past month,1 to 2 cups (8 to 16 ounces),1 time in the past month,3/4 to 1 1/2 cups (6 to 12 ounces),About  1/2 of the time,1 time in the past month,3/4 to 1 1/2 cups (6 to 12 ounces),Whole milk,.,.,.,.,.,1-2 times per week,1 to 1 1/2 cups (8 to 12 ounces),2-3 times in the past month,1 can or bottle (12 to 16 ounces),Almost always or always,Almost never or never,2-3 times in the past month,Less than 1 bottle (12 ounces),2-3 times in the past month,1 to 2 cups (8 to 16 ounces),6 or more times per day,More than 3 cups (24 ounces),Almost always or always,Almost never or never,About  1/4 of the time,2-3 times in the past month,1 to 2 bottles (12 to 20 ounces),2-3 times in the past month,1 to 3 12-ounce cans or bottles,Almost never or never,2-3 times in the past month,1 to 2 glasses (5 to 10 ounces),2-3 times in the past month,1 to 4 shots of liquor,1 cup per day,Almost always or always,Almost never or never,Almost never or never,Almost never or never,Almost never or never,2-3 times in the past month,Small to medium drink (12 to 16 ounces),Almost never or never,"Less than 1 glass, can, or bottle in the past month",Almost never or never,About  1/4 of the time,"Artificial sweeteners (such as Splenda, Equal, Sweet'N Low or others)",.,.,1-3 cups in the past month,Almost never or never,1-3 cups in the past month,Yes,Yes,Almost always or always,Less than 1 teaspoon,Almost always or always,Splenda or sucralose,Less than 1 packet or less than 1 teaspoon,Almost never or never,.,.,About  1/4 of the time,1 to 3 teaspoons,Regular,About  3/4 of the time,1 to 4 tablespoons,Whole milk,No,Yes,Yes,Yes,No,No,Yes,Yes,Yes,No,Yes,Yes,No,No,Yes,No,.,.,2-3 times in the past month,Less than 1 apple,2-3 times in the past month,1 banana,3-4 times per week,1/4 to  3/4 cup or 1 medium slice,.,.,.,.,2-3 times in the past month,1 to 4 tablespoons,2-3 times in the past month,1/2 to 1 1/2 cups or 10 to 30 grapes,3-4 times per week,1/4 melon or  1/2 to 1 cup,.,.,3-4 times per week,1/4 to  3/4 cup or 3 to 8 berries,2 times per week,Less than  1/4 cup,.,.,.,.,2 times per week,1/4 to  3/4 avocado or  1/4 to  3/4 cup of guacamole,.,.,No,No,Yes,No,No,Yes,No,No,No,Yes,No,Yes,Yes,Yes,Yes,Yes,Yes,No,No,Yes,Yes,Yes,Yes,No,No,Yes,No,.,.,.,.,1 time in the past month,1/2 to 1 1/2 cups,.,.,.,.,1 time per week,1/4 to  1/2 cup,.,.,.,.,.,.,3-4 times per week,1/4 to 1 1/2 cups,.,.,2-3 times in the past month,1/4 to  1/2 pepper,2-3 times in the past month,1 slice or 1 to 4 tablespoons,3-4 times per week,1 to 2 cloves or 1 to 2 teaspoons,1 time per week,Less than  3/4 cup,1 time per week,No,No,Yes,No,.,1 to 3 teaspoons,2-3 times in the past month,No,No,Yes,No,.,1 to 3 teaspoons,2-3 times in the past month,1/2 to 2 cups,About  1/4 of the time,2-3 times in the past month,1 to 3 tablespoons,.,.,.,.,2 times per week,1 to 4 tablespoons,2-3 times in the past month,1 to 4 teaspoons,1 time per week,1 medium potato or  1/4 to  3/4 cup,1 time per week,Less than 10 fries or less than  1/2 cup,.,.,.,.,.,.,.,.,.,.,2-3 times in the past month,1/4 to  3/4 cup,Almost never or never,.,.,No,No,Yes,No,.,.,.,.,.,.,.,2 times per week,About  1/4 of the time,About  1/4 of the time,"Fewer than 2 tacos or less than 1 burrito, etc.",.,.,.,Yes,Yes,Yes,Yes,No,No,Yes,1 time per week,1/2  to 1 cup,Almost always or always,1 time in the past month,Fewer than 5 pieces or less than 1 cup,2-3 times in the past month,1 to 2 cups,2-3 times in the past month,Less than 1 cup,.,.,.,.,.,.,.,2-3 times in the past month,1 to 3 slices or 1 mini pizza,Almost always or always,No,No,Yes,Yes,Yes,No,No,No,No,Yes,No,.,.,.,.,.,.,.,.,.,.,.,2-3 times in the past month,1 to 3 medium pieces,Almost never or never,Almost never or never,.,Almost always or always,1 to 5 tablespoons,Almost never or never,2 times per week,Less than 1 bagel or English muffin,Almost never or never,Almost never or never,Almost never or never,.,Almost never or never,.,2-3 times in the past month,1 to 2 slices or  1/2 to 1 roll,Almost always or always,Almost always or always,1 to 3 teaspoons,Almost never or never,Almost never or never,.,.,.,.,.,.,.,.,.,.,.,.,.,.,.,2-3 times in the past month,1 to 2 tablespoons,.,.,No,Yes,Yes,No,No,No,.,.,2-3 times in the past month,1 to 3 slices,2-3 times in the past month,2 to 4 slices,.,.,.,.,.,.,.,.,No,Yes,No,No,No,Yes,Yes,No,No,No,No,No,No,No,No,Yes,Yes,No,No,No,Yes,No,No,No,.,.,3-4 times per week,"Less than 2 drumsticks or wings, less than 1 breast or thigh, or less than 4 nuggets",Almost never or never,Almost never or never,Almost always or always,Almost never or never,Well-done,Almost always or always,Almost never or never,.,.,.,.,.,.,2-3 times in the past month,1 patty or 2 to 4 ounces,Almost never or never,About  1/2 of the time,About  1/2 of the time,Medium,2-3 times in the past month,3 to 8 ounces or  1/2 to 1 cup,.,.,.,.,.,.,.,.,.,.,.,.,.,.,.,.,.,.,.,.,.,.,.,.,1 time per week,1 to 3 slices,Almost always or always,Almost never or never,Almost never or never,Charred,2-3 times in the past month,Less than 1 patty or 2 links,About  1/2 of the time,About  1/2 of the time,About  1/2 of the time,Well-done/crisp,.,.,.,.,.,.,2-3 times in the past month,1 to 3 ounces,.,.,.,.,.,.,No,No,.,.,.,.,.,.,.,Yes,Yes,Yes,Yes,No,Yes,Yes,Yes,No,2-3 times in the past month,2 to 5 crackers,2-3 times in the past month,More than 25 chips or more than 1 cups,2-3 times in the past month,10 to 25 chips or 1 to 2 cups,2-3 times in the past month,"2 to 6 cups, popped",.,.,1 time per week,1/8 to  1/2 cup,Almost never or never,Almost never or never,2 times per week,1/2 to 1 bar,1 time per week,1 3/4 to 4 tablespoons or 1 to 2 scoops,.,.,Yes,No,Yes,Yes,1 time per week,1/2 to  3/4 cup or 1 container,Almost always or always,.,.,3-4 times per week,1/2 to 1 1/2 ounces or 1 slice,Almost never or never,2-3 times in the past month,More than 1 tablespoon,Almost never or never,Yes,Yes,Yes,No,Yes,Yes,Yes,Yes,No,Yes,No,1 time in the past month,1/2 to 1 1/2 cups or 1 to 2 scoops,1 time per week,1/2 to 1 1/2 cups or 1 to 2 scoops,Almost never or never,2-3 times in the past month,Less than 1 medium or less than  1/8 of a cake,.,.,.,.,1 time per week,2 to 4 cookies,2-3 times in the past month,1 medium brownie,2-3 times in the past month,Less than 1 piece,2-3 times in the past month,Less than 1 medium piece,.,.,3-4 times per week,More than 2 squares in a bar or more than 2 ounces,.,.,No,Yes,Yes,.,Almost never or never,Almost never or never,No,No,No,No,No,No,Yes,No,No,No,No,No,No,No,No,No,No,No,No,No,No,No,No,No,No,No,No,No,No,No,No,Yes,1-3 days per week,Prenatal multivitamin,.,No,.,.,.,.,.,.,.,.,.,.,.,.,.,.,.,.,.,.,.,.,.,.,.,.,.,.,.,.,.,.,.,.,.,.,.,.,.,.,.,.,.,.,No,No,No,No,No,No,No,No,No,No,No,No,No
