209,Fiber05,20180924,198805,Male,No,No,No,No,No,No,No,No,No,No,Yes,No,No,Yes,No,Yes,Yes,Yes,Yes,No,Yes,Yes,Yes,Yes,.,.,.,.,.,.,.,.,.,.,.,.,.,.,.,.,.,.,.,.,.,.,.,.,1-2 times per week,Less than 1 can or bottle (12 ounces),About  1/4 of the time,Almost never or never,.,.,.,.,4-5 times per day,1 to 3 cups (8 to 24 ounces),Almost never or never,Almost never or never,Almost always or always,.,.,2-3 times in the past month,1 to 3 12-ounce cans or bottles,Almost never or never,1 time in the past month,More than 2 glasses (10 ounces),2-3 times in the past month,1 to 4 shots of liquor,1 cup per day,Almost always or always,Almost never or never,Almost never or never,Almost never or never,Almost never or never,.,.,.,"2-4 glasses, cans, or bottles per week",Almost never or never,About  1/2 of the time,"Artificial sweeteners (such as Splenda, Equal, Sweet'N Low or others)",1 cup per week,Almost never or never,1 cup per week,Almost never or never,Less than 1 cup in the past month,Yes,Yes,Almost always or always,1 to 3 teaspoons,About  1/4 of the time,Sweet'N Low or saccharin,1 packet or 1 teaspoon,About  1/4 of the time,1 to 4 teaspoons,Low-fat or fat-free liquid,Almost never or never,.,.,Almost never or never,.,.,No,No,Yes,Yes,No,No,No,No,Yes,Yes,Yes,No,No,No,Yes,No,.,.,.,.,1 time in the past month,1 banana,1 time per week,1/4 to  3/4 cup or 1 medium slice,.,.,.,.,.,.,.,.,1 time in the past month,Less than  1/4 melon or less than  1/2 cup,1 time in the past month,Less than  1/2 cup or 1 small wedge,2-3 times in the past month,1/4 to  3/4 cup or 3 to 8 berries,.,.,.,.,.,.,2-3 times in the past month,1/4 to  3/4 avocado or  1/4 to  3/4 cup of guacamole,.,.,No,No,No,No,Yes,No,Yes,Yes,Yes,No,No,Yes,Yes,Yes,No,No,No,No,Yes,Yes,Yes,No,Yes,No,No,Yes,No,.,.,.,.,.,.,.,.,2-3 times in the past month,1/4 to  1/2 cup,.,.,1 time in the past month,Less than  3/4 cup,2-3 times in the past month,1/4 to  3/4 cup,2-3 times in the past month,1 ear or  1/2 to  3/4 cup,.,.,.,.,2-3 times in the past month,1/4 to  1/2 pepper,1 time per week,1 slice or 1 to 4 tablespoons,1 time per week,1 to 2 cloves or 1 to 2 teaspoons,.,.,2-3 times in the past month,No,Yes,No,No,1 to 2 teaspoons,.,NEVER,No,No,No,No,.,.,.,.,.,.,.,.,.,1 time per week,1/4 to  1/2 tomato,1 time per week,More than 4 tablespoons,1 time per week,1 to 4 teaspoons,.,.,1 time per week,10 to 25 fries or  1/2 to 1 1/4 cup,.,.,.,.,.,.,.,.,.,.,1 time per week,1/4 to  3/4 cup,About  1/2 of the time,.,.,Yes,No,Yes,Yes,1 time per week,1 to 2 cups,About  1/4 of the time,Almost never or never,About  3/4 of the time,.,.,1 time per week,About  1/4 of the time,About  1/2 of the time,"2 to 4 tacos or 1 to 2 burritos, etc.",1 time per week,2 to 4 small size tortillas or 1 to 2 large size tortillas,About  1/4 of the time,Yes,No,No,No,No,Yes,Yes,2 times per week,1/2  to 1 cup,Almost never or never,.,.,.,.,.,.,.,.,1 time in the past month,1 to 3 cups,Almost always or always,Almost never or never,Almost never or never,2-3 times in the past month,1 to 3 slices or 1 mini pizza,Almost always or always,No,No,Yes,No,Yes,Yes,No,Yes,Yes,No,No,.,.,.,.,.,.,.,.,.,.,.,1 time in the past month,1 to 3 medium pieces,Almost never or never,Almost always or always,1 to 3 teaspoons,Almost always or always,1 to 5 tablespoons,Almost never or never,.,.,.,.,.,.,.,.,3-4 times per week,1 to 2 slices or  1/2 to 1 roll,About  3/4 of the time,About  1/4 of the time,1 to 3 teaspoons,Almost never or never,Almost never or never,.,3-4 times per week,1 to 2 slices or  1/2 to 1 roll,Almost never or never,Almost always or always,Almost never or never,1 to 2 teaspoons,Almost never or never,.,.,.,1 time per day,1 to 2 biscuits,1 time in the past month,1 to 4 teaspoons,.,.,.,.,No,No,No,No,No,Yes,.,.,.,.,.,.,.,.,.,.,1 time in the past month,1 to 2 hot dogs,Almost never or never,Almost always or always,No,Yes,Yes,Yes,Yes,Yes,No,No,No,Yes,No,No,No,Yes,No,Yes,Yes,No,No,No,No,No,Yes,No,.,.,3-4 times per week,"2 drumsticks or wings, 1 breast or thigh, or 4 to 8 nuggets",About  1/4 of the time,Almost never or never,Almost never or never,Almost never or never,.,About  1/2 of the time,About  3/4 of the time,2-3 times in the past month,2 to 5 ounces or  1/2 to 1 cup,1 time in the past month,2 to 4 ounces,2-3 times in the past month,Medium (such as McDonald's or Burger King Double Burger or Cheeseburger),2-3 times in the past month,1 patty or 2 to 4 ounces,Almost never or never,Almost never or never,Almost always or always,Medium,.,.,.,.,.,.,1 time in the past month,3 to 7 ounces,Almost never or never,Almost always or always,Almost never or never,Medium,.,.,.,.,.,.,.,.,.,.,1 time per day,Less than  1/8 cup,.,.,1 time per day,1 to 3 slices,Almost always or always,Almost never or never,Almost never or never,Well-done/crisp,2-3 times in the past month,1 to 3 patties or 2 to 5 links,Almost never or never,Almost never or never,Almost always or always,Well-done/crisp,.,.,.,.,.,.,.,.,.,.,1 time in the past month,3 to 8 ounces or 1 fillet,.,.,No,Yes,.,.,1 time per day,2 eggs,About  1/2 of the time,Almost never or never,Almost never or never,No,Yes,Yes,No,No,No,No,No,Yes,.,.,2-3 times in the past month,10 to 25 chips or  1/2 to 1 cups,2 times per week,10 to 25 chips or 1 to 2 cups,.,.,.,.,.,.,.,.,.,.,.,.,2-3 times in the past month,1 to 2 bars,No,No,Yes,No,.,.,.,.,.,3-4 times per week,1/2 to 1 1/2 ounces or 1 slice,Almost never or never,.,.,.,No,No,No,No,Yes,No,No,No,No,Yes,No,.,.,.,.,.,.,.,.,.,.,.,2-3 times in the past month,Fewer than 2 cookies,.,.,.,.,.,.,.,.,2-3 times in the past month,1 to 2 squares in a bar or 1 to 2 ounces,.,.,Yes,Yes,Yes,Almost never or never,Almost never or never,About  1/2 of the time,No,No,No,No,No,No,No,No,No,No,No,No,No,No,No,No,No,No,No,No,No,No,No,No,No,No,No,No,No,No,No,No,.,.,.,.,.,.,.,.,.,.,.,.,.,.,.,.,.,.,.,.,.,.,.,.,.,.,.,.,.,.,.,.,.,.,.,.,.,.,.,.,.,.,.,.,.,.,.,.,.,.,.,.,.,.,.,.,.,.,.
209,Fiber07,20180919,199112,Male,No,No,No,No,No,Yes,No,Yes,No,No,Yes,Yes,No,Yes,No,No,No,No,No,No,Yes,No,Yes,No,.,.,.,.,.,.,.,.,.,.,.,2-3 times in the past month,3/4 to 1 1/2 cups (6 to 12 ounces),Almost never or never,.,.,.,2-3 times in the past month,More than 1 1/2 cups (12 ounces),About  1/2 of the time,.,.,.,.,1 time per day,1 can or bottle (12 to 16 ounces),About  3/4 of the time,Almost never or never,2-3 times in the past month,1 to 2 bottles (12 to 24 ounces),.,.,4-5 times per day,More than 3 cups (24 ounces),About  1/2 of the time,Almost never or never,About  1/2 of the time,.,.,.,.,.,.,.,.,.,.,.,.,.,.,.,.,.,.,"1-3 glasses, cans, or bottles in the past month",Almost never or never,Almost always or always,"Artificial sweeteners (such as Splenda, Equal, Sweet'N Low or others)",.,.,2-4 cups per week,Almost never or never,.,No,No,.,.,.,.,.,.,.,.,.,.,.,.,.,.,No,Yes,No,Yes,No,Yes,No,Yes,No,No,No,Yes,Yes,No,No,Yes,.,.,2 times per week,1 apple,.,.,2-3 times in the past month,1/4 to  3/4 cup or 1 medium slice,.,.,2-3 times in the past month,1 fruit,.,.,1 time in the past month,1/2 to 1 1/2 cups or 10 to 30 grapes,.,.,.,.,.,.,2-3 times in the past month,1/4 to  1/2 cup,2-3 times in the past month,"1 orange or tangerine, or 2 clementines",.,.,.,.,2 times per week,1/4 to 1 cup,No,No,No,No,No,No,Yes,No,No,No,No,No,Yes,No,No,Yes,Yes,No,No,No,No,No,Yes,No,No,No,No,.,.,.,.,.,.,.,.,.,.,.,.,2-3 times in the past month,3/4 to 1 1/4 cups,.,.,.,.,.,.,.,.,.,.,2-3 times in the past month,1 slice or 1 to 4 tablespoons,.,.,.,.,NEVER,No,No,No,No,.,.,NEVER,No,No,No,No,.,.,3-4 times per week,1/2 to 2 cups,Almost always or always,3-4 times per week,1 to 3 tablespoons,.,.,.,.,.,.,.,.,.,.,1 time in the past month,10 to 25 fries or  1/2 to 1 1/4 cup,.,.,.,.,.,.,.,.,.,.,.,.,.,.,.,No,No,Yes,No,.,.,.,.,.,.,.,1 time per week,Almost never or never,About  3/4 of the time,"2 to 4 tacos or 1 to 2 burritos, etc.",.,.,.,Yes,No,No,No,No,Yes,Yes,1 time in the past month,1/2  to 1 cup,Almost never or never,.,.,.,.,.,.,.,.,1 time per week,1 to 3 cups,Almost never or never,Almost never or never,Almost always or always,2-3 times in the past month,1 to 3 slices or 1 mini pizza,Almost always or always,No,No,No,Yes,Yes,Yes,No,Yes,No,Yes,No,.,.,.,.,.,.,.,.,.,.,.,.,.,.,.,.,.,.,.,1 time in the past month,1 to 2 bagels or English muffins,Almost never or never,Almost always or always,Almost never or never,Less than 1 tablespoon,Almost never or never,.,3-4 times per week,1 to 2 slices or  1/2 to 1 roll,About  1/4 of the time,Almost never or never,.,Almost never or never,Almost never or never,.,2-3 times in the past month,1 to 2 slices or  1/2 to 1 roll,Almost never or never,Almost always or always,Almost never or never,1 to 2 teaspoons,Almost never or never,.,.,.,2-3 times in the past month,1 to 2 biscuits,.,.,2 times per week,1 to 2 tablespoons,.,.,No,No,Yes,No,No,No,.,.,.,.,3-4 times per week,2 to 4 slices,.,.,.,.,.,.,.,.,No,Yes,Yes,No,Yes,No,Yes,No,No,No,No,No,No,No,No,Yes,Yes,No,No,No,Yes,No,No,No,.,.,1 time per week,"2 drumsticks or wings, 1 breast or thigh, or 4 to 8 nuggets",Almost never or never,Almost never or never,Almost always or always,Almost never or never,Well-done,Almost always or always,Almost never or never,2 times per week,2 to 5 ounces or  1/2 to 1 cup,.,.,2-3 times in the past month,Medium (such as McDonald's or Burger King Double Burger or Cheeseburger),.,.,.,.,.,.,1 time in the past month,3 to 8 ounces or  1/2 to 1 cup,.,.,.,.,.,.,.,.,.,.,.,.,.,.,.,.,.,.,.,.,.,.,.,.,2-3 times in the past month,1 to 3 slices,Almost always or always,Almost never or never,Almost never or never,Well-done/crisp,2-3 times in the past month,1 to 3 patties or 2 to 5 links,Almost never or never,Almost never or never,Almost always or always,Just until done,.,.,.,.,.,.,1 time in the past month,1 to 3 ounces,.,.,.,.,.,.,No,Yes,.,.,2 times per week,1 egg,About  3/4 of the time,About  1/2 of the time,Almost never or never,No,Yes,Yes,Yes,Yes,Yes,No,No,No,.,.,1 time per week,10 to 25 chips or  1/2 to 1 cups,2-3 times in the past month,More than 25 chips or more than 2 cups,1 time per week,"2 to 6 cups, popped",1 time in the past month,5 to 20 average twists,2-3 times in the past month,1/8 to  1/2 cup,About  3/4 of the time,Almost never or never,.,.,.,.,.,.,No,No,Yes,No,.,.,.,.,.,3-4 times per week,More than 1 1/2 ounces or more than 1 slice,Almost never or never,.,.,.,Yes,Yes,No,No,Yes,Yes,Yes,No,No,Yes,No,2-3 times in the past month,1/2 to 1 1/2 cups or 1 to 2 scoops,1 time in the past month,1/2 to 1 1/2 cups or 1 to 2 scoops,About  1/4 of the time,.,.,.,.,.,.,2 times per week,2 to 4 cookies,2-3 times in the past month,1 medium brownie,1 time in the past month,1 to 2 pieces,.,.,.,.,3-4 times per week,More than 2 squares in a bar or more than 2 ounces,.,.,Yes,No,Yes,Almost never or never,.,Almost never or never,No,No,No,No,No,No,Yes,No,No,Yes,No,No,No,No,No,No,No,No,No,No,No,No,No,No,No,No,No,Yes,No,No,No,No,1-3 days per month,Multivitamin,Yes,No,.,.,.,Everyday,1,Extra Strength,.,.,.,.,.,.,.,.,.,.,.,.,.,.,.,.,.,.,.,.,.,.,.,.,.,.,.,.,4-6 days per week,500 - 999 mg,.,.,.,.,.,.,.,.,.,.,.,.,.,.,.,.,.,.,.
209,Fiber09,20180919,199202,Female,No,Yes,No,No,No,Yes,No,No,No,No,Yes,No,No,Yes,No,No,Yes,No,Yes,Yes,No,No,No,Yes,.,.,3-4 times per week,Less than  3/4 cup (6 ounces),Almost always or always,.,.,.,.,.,.,1 time in the past month,3/4 to 1 1/2 cups (6 to 12 ounces),Almost never or never,.,.,.,.,.,.,.,.,.,.,2-3 times in the past month,Less than 1 can or bottle (12 ounces),Almost always or always,Almost never or never,.,.,.,.,6 or more times per day,1 to 3 cups (8 to 24 ounces),About  3/4 of the time,Almost never or never,Almost always or always,.,.,.,.,.,2-3 times in the past month,Less than 1 glass (5 ounces),.,.,2-4 cups per week,About  3/4 of the time,Almost never or never,Almost never or never,Almost never or never,About  1/4 of the time,3-4 times per week,Less than a small drink (12 ounces),Almost never or never,.,.,.,.,.,.,.,.,1 cup per week,No,No,.,.,.,.,.,.,.,.,.,.,.,.,.,.,Yes,Yes,Yes,No,No,No,Yes,No,Yes,Yes,Yes,No,No,No,Yes,No,2-3 times in the past month,.,2 times per week,Less than 1 apple,1 time per week,Less than 1 banana,.,.,.,.,.,.,2-3 times in the past month,Less than 1 tablespoon,.,.,1 time per week,Less than  1/4 melon or less than  1/2 cup,2-3 times in the past month,Less than  1/2 cup or 1 small wedge,1 time per week,1/4 to  3/4 cup or 3 to 8 berries,.,.,.,.,.,.,2-3 times in the past month,1/4 avocado or less than  1/4 cup of guacamole,.,.,No,Yes,No,No,No,Yes,No,No,Yes,Yes,No,Yes,Yes,No,No,No,No,No,Yes,Yes,No,No,Yes,No,Yes,Yes,No,.,.,1 time per week,1/2 to 1 3/4 cups,.,.,.,.,.,.,2 times per week,1/4 to  1/2 cup,.,.,.,.,2-3 times in the past month,Less than 1 ear or less than  1/2 cup,2 times per week,1/4 to 1 1/2 cups,.,.,2 times per week,1/4 to  1/2 pepper,1 time per week,1 slice or 1 to 4 tablespoons,.,.,.,.,2 times per week,No,Yes,Yes,Yes,Less than 1 teaspoon,Less than 1 teaspoon,1 time in the past month,No,Yes,No,No,Less than 1 teaspoon,.,.,.,.,.,.,.,.,2 times per week,1/4 to  1/2 tomato,2 times per week,Less than 1 tablespoon,.,.,.,.,2 times per week,10 to 25 fries or  1/2 to 1 1/4 cup,.,.,2 times per week,1 medium potato or  1/2 to  3/4 cup,About  1/4 of the time,About  1/4 of the time,Less than 1 tablespoon,About  1/4 of the time,About  1/4 of the time,Less than 1 teaspoon,2 times per week,1/4 to  3/4 cup,Almost never or never,.,.,No,No,Yes,No,.,.,.,.,.,.,.,1 time per week,About  1/4 of the time,About  1/4 of the time,"2 to 4 tacos or 1 to 2 burritos, etc.",.,.,.,Yes,Yes,Yes,Yes,No,Yes,No,2 times per week,1/2  to 1 cup,About  1/2 of the time,1 time in the past month,5 to 8 pieces or 1 to 2 cups,2-3 times in the past month,1 to 2 cups,1 time per week,1 to 2 cups,.,.,2-3 times in the past month,1 to 3 cups,About  1/2 of the time,About  1/4 of the time,Almost never or never,.,.,.,No,No,No,Yes,Yes,No,No,No,No,Yes,No,.,.,.,.,.,.,.,.,.,.,.,.,.,.,.,.,.,.,.,2-3 times in the past month,Less than 1 bagel or English muffin,Almost never or never,About  1/4 of the time,About  1/4 of the time,Less than 1 tablespoon,Almost never or never,.,3-4 times per week,1 to 2 slices or  1/2 to 1 roll,About  1/4 of the time,Almost never or never,.,About  1/4 of the time,About  1/4 of the time,Less than 1 teaspoon,.,.,.,.,.,.,.,.,.,.,.,.,.,.,2 times per week,1 to 2 tablespoons,.,.,No,No,Yes,No,No,No,.,.,.,.,2-3 times in the past month,2 to 4 slices,.,.,.,.,.,.,.,.,No,Yes,Yes,No,Yes,No,Yes,No,No,No,No,No,No,No,No,Yes,No,No,No,Yes,No,No,No,No,.,.,3-4 times per week,"2 drumsticks or wings, 1 breast or thigh, or 4 to 8 nuggets",About  1/2 of the time,About  1/4 of the time,About  1/2 of the time,Almost never or never,Well-done,Almost always or always,About  1/4 of the time,2 times per week,2 to 5 ounces or  1/2 to 1 cup,.,.,2 times per week,Medium (such as McDonald's or Burger King Double Burger or Cheeseburger),.,.,.,.,.,.,1 time per week,3 to 8 ounces or  1/2 to 1 cup,.,.,.,.,.,.,.,.,.,.,.,.,.,.,.,.,.,.,.,.,.,.,.,.,2 times per week,1 to 3 slices,About  3/4 of the time,Almost never or never,Almost never or never,Well-done/crisp,.,.,.,.,.,.,.,.,.,.,2-3 times in the past month,More than 7 ounces,.,.,.,.,.,.,.,.,No,Yes,.,.,1 time in the past month,.,.,.,.,Yes,Yes,Yes,Yes,Yes,Yes,No,No,No,1 time per week,More than 5 crackers,1 time per week,10 to 25 chips or  1/2 to 1 cups,1 time per week,10 to 25 chips or 1 to 2 cups,2-3 times in the past month,"2 to 6 cups, popped",2 times per week,More than 20 average twists,3-4 times per week,1/8 to  1/2 cup,About  1/4 of the time,About  1/2 of the time,.,.,.,.,.,.,Yes,No,Yes,No,2 times per week,1/2 to  3/4 cup or 1 container,About  1/4 of the time,.,.,5-6 times per week,1/2 to 1 1/2 ounces or 1 slice,About  1/4 of the time,.,.,.,Yes,Yes,No,No,Yes,Yes,No,No,No,Yes,No,1 time in the past month,1/2 to 1 1/2 cups or 1 to 2 scoops,1 time per week,1/2 to 1 1/2 cups or 1 to 2 scoops,Almost never or never,.,.,.,.,.,.,3-4 times per week,2 to 4 cookies,2-3 times in the past month,1 small brownie,.,.,.,.,.,.,2 times per week,1 to 2 squares in a bar or 1 to 2 ounces,.,.,Yes,Yes,No,Almost never or never,About  1/2 of the time,.,No,No,No,No,No,No,No,No,No,No,No,No,No,No,No,No,No,No,No,No,No,No,No,No,No,No,No,No,Yes,No,No,No,.,.,.,.,.,.,.,.,.,.,.,.,.,.,.,.,.,.,.,.,.,.,.,.,.,.,.,.,.,.,.,.,.,.,.,.,.,.,.,.,1-3 days per week,"2,000 - 4,999 IU",.,.,.,.,.,.,.,.,.,.,.,.,.,.,.,.,.
209,Fiber10,20180926,199003,Female,No,No,No,Yes,Yes,No,No,No,No,No,Yes,Yes,Yes,Yes,Yes,No,No,No,Yes,No,Yes,No,No,Yes,.,.,.,.,.,.,.,1-2 times per week,Less than  3/4 cup (6 ounces),2-3 times in the past month,1 to 2 cups (8 to 16 ounces),.,.,.,.,.,.,.,.,.,.,.,.,.,2-3 times in the past month,1 can or bottle (12 to 16 ounces),Almost always or always,Almost never or never,1-2 times per week,1 to 2 bottles (12 to 24 ounces),1-2 times per week,1 to 2 cups (8 to 16 ounces),5-6 times per week,More than 3 cups (24 ounces),Almost never or never,Almost always or always,Almost always or always,1-2 times per week,1 to 2 bottles (12 to 20 ounces),.,.,.,.,.,.,.,2-3 cups per day,Almost always or always,Almost never or never,Almost never or never,Almost never or never,Almost never or never,.,.,.,"2-3 glasses, cans, or bottles per day",Almost never or never,Almost never or never,.,.,.,.,.,1-3 cups in the past month,No,Yes,.,.,.,.,.,Almost never or never,.,.,Almost always or always,1 to 3 teaspoons,Regular,Almost always or always,1 to 4 tablespoons,Whole milk,No,Yes,Yes,Yes,No,Yes,Yes,Yes,Yes,Yes,Yes,Yes,Yes,No,Yes,No,.,.,2-3 times in the past month,1 apple,1 time per week,1 banana,3-4 times per week,1/4 to  3/4 cup or 1 medium slice,.,.,1 time per week,1 fruit,3-4 times per week,1 to 4 tablespoons,3-4 times per week,Less than  1/2 cup or fewer than 10 grapes,3-4 times per week,Less than  1/4 melon or less than  1/2 cup,3-4 times per week,Less than  1/2 cup or 1 small wedge,3-4 times per week,1/4 to  3/4 cup or 3 to 8 berries,1 time per week,Less than  1/4 cup,1 time per week,"1 orange or tangerine, or 2 clementines",.,.,2-3 times in the past month,1/4 avocado or less than  1/4 cup of guacamole,.,.,No,Yes,No,No,Yes,Yes,No,Yes,No,Yes,Yes,Yes,Yes,Yes,Yes,Yes,No,No,Yes,Yes,Yes,Yes,No,No,No,Yes,No,.,.,2 times per week,1/2 to 1 3/4 cups,.,.,.,.,1 time per week,1/4 to  1/2 cup,2-3 times in the past month,1/4 to  1/2 cup,.,.,2-3 times in the past month,1/4 to  3/4 cup,.,.,3-4 times per week,1/4 to 1 1/2 cups,1 time per week,Less than  1/4 cup,2 times per week,Less than  1/4 pepper,3-4 times per week,More than 1 slice or more than 4 tablespoons,2-3 times in the past month,Less than 1 clove or less than 1 teaspoon,2-3 times in the past month,Less than  3/4 cup,2 or more times per day,No,No,Yes,No,.,Less than 1 teaspoon,NEVER,No,No,No,No,.,.,1 time per week,Less than  1/2 cup,Almost always or always,.,.,.,.,1 time per week,Less than  1/4 tomato,1 time per week,1 to 4 tablespoons,5-6 times per week,1 to 4 teaspoons,2 times per week,1 medium potato or  1/4 to  3/4 cup,.,.,.,.,.,.,.,.,.,.,.,.,1 time in the past month,Less than  1/4 cup,Almost never or never,.,.,Yes,No,Yes,No,2 times per week,1 to 2 cups,About  1/2 of the time,About  1/2 of the time,About  1/4 of the time,.,.,.,.,.,"Fewer than 2 tacos or less than 1 burrito, etc.",.,.,.,Yes,No,Yes,Yes,No,No,Yes,2 times per week,Less than  1/2 cup,About  3/4 of the time,.,.,2-3 times in the past month,Less than 1 cup,1 time per week,Less than 1 cup,.,.,.,.,.,.,.,2-3 times in the past month,1 to 3 slices or 1 mini pizza,Almost never or never,Yes,Yes,Yes,Yes,Yes,Yes,No,No,No,No,No,3-4 times per week,3/4 to 1 1/4 cups,2 times per week,1 to 2 cups,About  3/4 of the time,About  3/4 of the time,About  1/4 of the time,About  1/4 of the time,Yes,"Skim, nonfat, or  1/2% fat milk",Less than  1/2 cup (4 ounces),2 times per week,1 to 3 medium pieces,Almost always or always,Almost never or never,1 to 3 teaspoons,Almost always or always,1 to 5 tablespoons,Almost never or never,3-4 times per week,Less than 1 bagel or English muffin,About  1/4 of the time,Almost never or never,Almost never or never,.,Almost never or never,.,2 times per week,1 to 2 slices or  1/2 to 1 roll,.,.,.,.,.,.,2-3 times in the past month,1 to 2 slices or  1/2 to 1 roll,Almost always or always,Almost never or never,Almost never or never,.,Almost never or never,.,.,.,.,.,.,.,.,.,.,.,Yes,Yes,Yes,No,No,No,1 time in the past month,1 to 2 slices or 2 to 4 ounces,1 time in the past month,1 to 3 slices,2-3 times in the past month,2 to 4 slices,.,.,.,.,.,.,.,.,Yes,Yes,Yes,No,No,No,No,No,No,No,No,No,No,No,No,Yes,Yes,No,No,Yes,No,No,No,No,1 time per week,2 to 5 ounces or  1/2 to 1 cup,3-4 times per week,"2 drumsticks or wings, 1 breast or thigh, or 4 to 8 nuggets",Almost never or never,Almost never or never,Almost never or never,Almost always or always,Just until done,Almost always or always,Almost never or never,1 time per week,2 to 5 ounces or  1/2 to 1 cup,.,.,.,.,.,.,.,.,.,.,.,.,.,.,.,.,.,.,.,.,.,.,.,.,.,.,.,.,.,.,.,.,.,.,.,.,1 time per week,Less than 1 slice,Almost always or always,Almost never or never,Almost never or never,Well-done/crisp,2-3 times in the past month,Less than 1 patty or 2 links,About  1/2 of the time,Almost never or never,Almost always or always,Just until done,.,.,.,.,2-3 times in the past month,2 to 7 ounces,.,.,.,.,.,.,.,.,No,Yes,.,.,3-4 times per week,2 eggs,Almost always or always,Almost never or never,Almost never or never,No,No,Yes,Yes,No,Yes,No,No,No,.,.,.,.,2-3 times in the past month,10 to 25 chips or 1 to 2 cups,2-3 times in the past month,"Less than 2 cups, popped",.,.,1 time per week,Les than  1/8 cup,About  3/4 of the time,Almost never or never,.,.,.,.,.,.,Yes,Yes,Yes,Yes,1 time per week,Less than  1/2 cup or less than 1 container,About  1/4 of the time,1 time in the past month,Less than  1/4 cup,3-4 times per week,1/2 to 1 1/2 ounces or 1 slice,Almost never or never,2 times per week,1/2 to 1 tablespoon,Almost never or never,Yes,Yes,Yes,No,Yes,Yes,No,No,Yes,Yes,No,1 time per week,1/2 to 1 1/2 cups or 1 to 2 scoops,3-4 times per week,1/2 to 1 1/2 cups or 1 to 2 scoops,About  1/2 of the time,2-3 times in the past month,1 medium piece or  1/8 of a cake,.,.,.,.,2 times per week,Fewer than 2 cookies,2-3 times in the past month,1 medium brownie,.,.,.,.,1 time in the past month,Less than  1/2 cup,3-4 times per week,Less than 1 square in a bar or less than 1 ounce,.,.,Yes,No,Yes,About  1/2 of the time,.,Almost never or never,No,No,No,No,No,No,No,No,No,No,No,No,No,No,No,No,No,No,No,No,No,No,No,No,No,No,No,No,No,No,No,No,.,.,.,.,.,.,.,.,.,.,.,.,.,.,.,.,.,.,.,.,.,.,.,.,.,.,.,.,.,.,.,.,.,.,.,.,.,.,.,.,.,.,.,.,.,.,.,.,.,.,.,.,.,.,.,.,.,.,.
